Lodge_name,Lodge_address,Lodge_rate,Lodge_type,Lodge_RealImgName,Lodge_Tel,Lodge_content,Lodge_SellerInfo_BusinessNum
 전주 MH HOTEL 중화산동점,전북 전주시 완산구 중화산동2가 6572,9.7,모텔,//image.goodchoice.kr/resize_490x348/adimg_new/54353/427199/78cbdd2cd0543b06049814fc35fea958.jpg,050440383614,사장님 한마디                    ※ 현장결제 할인 이벤트  1인출장  도보고객 현장결제 시 1만원 즉시할인전주 MH호텔 중화산동점 입니다.이번에 새롭게 단장하여 오픈 하였습니다.  전 객실 금연입니다.   흡연실 1층 전 객실  라텍스 토퍼 매트리스 전 객실  LG 트롬 스타일러 전 객실  세스코 방역 전 객실  코웨이 공기청정기 전 객실  태평양물산 오리털 침구류 전 객실  LED화장거울 객실 차등 LG 55인치  65인치  75인치 TV                주차장 정보만차 시 프론트 에서 발렛 파킹 해드리고 있습니다.감사합니다 ^_^총 15대 주차시설 보유주변 정보숙소 주변 도보 5분 내에 편의점  맥도날드  롯데리아  스타벅스  식당가 가 위치하고 있습니다.전주 화산체육관 까지 1 km 차량으로 3분 거리 입니다.전주 완산수영장 까지 3.4 km 차량으로 8분 거리 입니다.전주 한옥마을 까지 3.1km 차량으로 8분 거리 입니다.전주 객리단길 까지 1.6km 차량으로 5분 거리 입니다.전주 터미널 까지 2.7km 차량으로 5분 거리 입니다.전주 전주역 까지 6.4km 차량으로 15분 거리 입니다.전주 남부시장 까지 2.8km 차량으로 7분 거리 입니다.전주 자만벽화마을 까지 4.5km 차량으로 12분 거리 입니다.전주 도청 까지 1.9km 차량으로 5분 거리 입니다.전주 시청 까지 3.6km 차량으로 8분 거리 입니다.객실내부 시설 전 객실 LG트롬 스타일러 전 객실 삼성 무풍 시스템 냉난방기 전 객실 LED 조명 거울 전 객실 태평양 물산 오리털침구류 전 객실 코웨이 공기청정기 전 객실 메모리 토퍼형 매트리스 객실 차등 LG 55인치  65인치  75인치 스마트 TV프런트 및 그 외 시설1층 로비 공간 일체형PC & 복합기   정수기  전자렌지,1
 전주 브라운도트  덕진점,전북 전주시 덕진구 덕진동2가 20017,9.5,모텔,//image.goodchoice.kr/resize_490x348/adimg_new/67734/369254/355d9b324519c787b98281df032e7c03.jpg,050440037744,사장님 한마디                    도심 속 프리미엄 부티크 호텔 브랜드   브라운도트 전주덕진점   입니다.브라운도트 호텔은 익숙하지만 일상에서 벗어나 감성을 자극할 수 있는 도심 속 부티크 공간으로  취향에 상관없이 누구나 호감을 가질만한  대중적이면서 개성있는 호텔입니다.방문해주시는 모든분들께 소중한 하루를 선물하겠습니다.                주차장 정보호텔 내부 주차장 이용 가능하십니다^^[주차장 보유 숙소입니다.  주차장 및 도보 모두 이용해 주세요]만차시 2분거리 주차장 이용하실 수 있습니다.총 35대 주차시설 보유주변 정보전주버스터미널까지 2.2km 차량 10분내외전주한옥마을까지 4.6km 차량 15분 내외전주KTX역까지 4.8km 차량 15분 내외전북대학교 까지 700m 차량 5분 내외 도보 10분 내외전주 덕진호수 공원까지 500m 도보 5~10분전주 산업단지 까지 3km 차량 10분 내외객실내부 시설전객실 넷플릭스 시청 가능  스마트 TV프리미엄  디럭스 트윈 스타일러 설치커플 PC  베그 가능  공기청정기 설치전 객실 프리미엄 호텔 침구류 비치추가 안내사항주말(금 토 일) 연박 이용 시 현장에서 1박 2만원 추가 요금 발생합니다.체크인시 브라운도트 덕진점 포인트 적립 진행  숙박 10 000원   대실 5 000원 적립,2
 호텔 토랑 전주,전북 전주시 덕진구 산정동 8604,9.0,호텔,//image.goodchoice.kr/resize_490x348/affiliate/2023/08/10/64d49277b6886.jpg,0632454848,사장님 한마디                    호텔 토랑은 호텔과 레스토랑의 합성어로 숙소와 음식 걱정을 줄여 완벽한 휴식과 감동을 선사하고자 편의성을 높인 서비스를 제공하고 있습니다객실 내에서 QR코드와 PC로 편리하게 주문 가능한 룸서비스와 호텔 계정으로 시청 가능한 OTT를 이용하며 편안한 휴식을 즐길 수 있습니다                주변정보전주역 차량 6분전주한옥마을 차량 10분국립전주박물관 차량 30분기본정보체크인 : 16:00 | 체크아웃 : 12:0022시 이후 체크인 시 호텔 프론트 문의프론트 운영 시간 : 06:00~익일 03:00무료 WiFi전 객실 금연Bath Amenity (치약  칫솔 무료)[주차 안내]주차 가능 (객실당 1대 주차 무료)호텔 내부 주차장   최대 17대 주차 가능 규모호텔 내부 주차장 만차 시  인근 공영주차장 이용 (무료)인원 추가 정보기준인원 외 추가 시  1인 10 000원(7세 이상~성인)침구 추가 : 1채 10 000원엑스트라베드 추가 불가영유아 인원수 포함   최대인원 초과 불가현장 결제투숙객 혜택전 객실 호텔 계정으로 OTT 채널 시청 가능 (넷플릭스  디즈니+  유튜브  티빙  왓챠)룸서비스   일~목 18:00~22:00  금~토 18:00~23:00   유료   QR코드 이용하여 주문평일 룸서비스 3 000원 할인 쿠폰 제공체크인 전 짐 보관 가능취사 시설전 객실 취사 불가취소 및 환불 규정체크인일 기준 1일 전 24시까지 : 100% 환불체크인일 기준 당일 및 Noshow : 환불 불가취소  환불 시 수수료가 발생할 수 있습니다확인사항 및 기타위의 정보는 호텔의 사정에 따라 변경될 수 있습니다객실에 따라 이미지와 다른 객실로 배정될 수 있습니다업체 물품의 파손 및 분실 시 업체 기준으로 변상하셔야 합니다기본 에티켓을 지키지 않거나 타인에게 피해를 주거나 불쾌감을 주는 행위는 강제 퇴실 조치 사유입니다화재 예방을 위해 객실 내 취사 및 화기 사용이 금지됩니다성인을 동반하지 않은 미성년자는 입실이 불가하며 해당 사유로 인한 환불 또한 불가합니다가족을 제외한 3인 이상 투숙 시 혼숙이 불가합니다,3
 군산 마루호텔,전북 군산시 신영동 214,9.9,모텔,//image.goodchoice.kr/resize_490x348/adimg_new/72002/466483/89c5e9936b482f585c9592b522fd0f9f.jpg,050448822860,주차장 정보정문주차  15대후문주차. 15대발렛주차 .  대형버스 숙소문의..대형공터있음 전객실  금연입니다..총 30대 주차시설 보유주변 정보 이성당 차량 3분 도보7분 서원반점 차량1분 도보 3분   근대역사박물관 차량 2분 도보5분 진포해양공원 도보 4분 차량5분 군산시외버스터미널 차량5분 도보10분.  군산역 차량8분. 군산CC차량20분. 군산짭뽕거리 차량3분 도보5분신영시장 도보5분  순대국밥 특화거리 도보5분   그외 맛집  차량10분거리 유명관광지10분객실내부 시설 ★ GRAND OPEN★   ★ GRAND OPEN★        전객실 호텔식 침구 구비      전객실 WiFi 제공      전객실 넷플릭스 유튜브시청가능      전객실 65인치 TV              코지마 안마의자        삼성 의류관리기(스타일러)~~>  객실선택      전객실 금연.프런트 및 그 외 시설24시간 데스크카페테리아 오픈  스낵바업무용 프린트 복사    주차공간여유로운  35 주차가능 전객실  금연.,4
 군산 월명동앤 게스트하우스,전라북도 군산시 월명동 16  　,7,게스트하우스,//image.goodchoice.kr/resize_490x348/adimg_new/75542/0/55f0a28517ebeec40b5afbe4ec6e9e11.jpg,050214822596,사장님 한마디                    근대문화 유산 거리 중심인 군산 시간여행 마을 월명동에 있습니다월명동앤은 도자기 그릇에 그림 그리는 주인장인 제가 조용하고 편안하게 힐링할 수 있는 게스트하우스와 예쁜 그릇 공방을 같이 운영하고 있습니다. 시간여행마을(동국사  히로스가옥  말랭이 마을  초원사진관  이성당  근대역사박물관)을 관광하시고 돌아와 예쁜 도자기 핸드페인팅 체험을 하며 그날의 감성을 예쁜 그릇에 담아 행복과 추억을 담아보세요월명동앤은 월명동 그리고…. “추억  사랑  행복”을 담는다를 뜻한답니다                오시는 길[군산고속버스터미널에서 오시는 방법]`군산고속버스터미널`에서`해망록`방면으로 우회전해주세요경암사거리에서` 공설시장`방면으로 좌회전해주세요`월명공원  내향` 방면으로 우회전해주세요`구영5길` 방면으로 좌회전해주시면 저희 게스트하우스로 오실 수 있으십니다주변정보신흥동일본식가옥 도보 4분동국사 도보 7분월명호수 차량 7분숙소 이용 규칙늦은 체크인 시 사전 연락 필수전 객실 금연 (금연 건물로 흡연 시 미환불 강제 퇴실)객실 내 식음 금지시설물을 파손하거나 침구류 훼손 및 오염(세탁 불가능) 시 전액 배상타인에게 피해나 불쾌감을 주는 행위 또는 게스트하우스 이용 규정을 지키지 않을 경우 강제 퇴실 조치보호자 미동반 미성년자 입실 불가 (업체 문의 필수) 월명호수현장 요금 추가 정보인원 추가 1인 15 000원주차장 정보숙소 앞 월명동 주민센터취소 및 환불 규정체크인일 기준 6일 전 : 100% 환불체크인일 기준 5 ~ 4일 전 : 50% 환불체크인일 기준 3일 전 ~ 당일 및 NoShow : 환불 불가취소  환불 시 수수료가 발생할 수 있습니다확인 사항 및 기타시즌별 객실 가격 상이하오니 확인 바랍니다위의 정보는 게스트하우스 사정에 따라 변경될 수 있습니다해당 이미지는 실제와 상이 할 수 있습니다예약 확정 이후의 취소는 취소환급 규정에 의거하여 적용됩니다,5
 전주한옥마을 가락청,전라북도 전주시 완산구 풍남동3가 392  　,7,게스트하우스,//image.goodchoice.kr/resize_490x348/adimg_new/75094/0/67f4cea74f3a161185a1c4bb10923c4e.jpg,050440282023,사장님 한마디                    낮에는 은은한 소리 가락이 밤에는 고즈넉한 한옥의 분위기를 즐기실 수 있는 한옥숙박체험 게스트 하우스입니다.전주 한옥마을 제2공영 주차장과 도보1분 내로 가깝습니다.전주 대사습청 전통 술박물관 옆라인에 위치하여 있고라한호텔 야외 루프탑 수영장을 이용하기에 편리한 바로 맞은편에 있습니다.저희 가락청에 오신다면 귀하의 즐겁고 편안한 여행의 쉼터를 마련해 드리겠습니다.오시는 길[전주고속버스터미널에서 오시는 방법]  전주천동로   방면으로 우회전 후 10M 이동해주세요  시외버스터미널   방면으로 우회전 후 448M 이동해주세요  어진길   방면으로 우회전 후 3KM 이동해주세요  한지길   방면으로 우회전 후 102M 이동해주시면 저희 게스트하우스가 있습니다주변정보전주고속버스터미널 차량 12분전주경기전 도보 5분완산칠봉꽃동산 차량 9분숙소 이용 규칙늦은 체크인 시 사전 연락 필수전 객실 금연 (금연 건물로 흡연 시 미환불 강제 퇴실)객실 내 식음 금지시설물을 파손하거나 침구류 훼손 및 오염(세탁 불가능) 시 전액 배상타인에게 피해나 불쾌감을 주는 행위 또는 게스트하우스 이용 규정을 지키지 않을 경우 강제 퇴실 조치보호자 미동반 미성년자 입실 불가 (업체 문의 필수)현장 요금 추가 정보기준 인원 외 1인당  10 000원주차장 정보한옥 마을 공용 주차장 유료 주차 가능취소 및 환불 규정체크인일 기준 7일 전 : 100% 환불체크인일 기준 6 ~ 4일 전 : 50% 환불체크인일 기준 3일 전 ~ NoShow : 환불불가취소  환불시 수수료가 발생할 수 있습니다.확인 사항 및 기타시즌별 객실 가격 상이하오니 확인바랍니다위의 정보는 게스트하우스 사정에 따라 변경될 수 있습니다해당 이미지는 실제와 상이 할 수 있습니다예약 확정 이후의 취소는 취소환불규정에 의거하여 적용됩니다,6
 전주 스테이노트,전북 전주시 완산구 다가동1가 449,7,펜션,//image.goodchoice.kr/resize_490x348/affiliate/2023/05/09/645a07cc3b4d6.jpg,050213787144,사장님 한마디                    사계절 내내 24시간 온수로 편안하고 특별한 시간을 보내실 수 있는 풀빌라입니다디자인 전문 호트가 직접 디자인  시공한 공간으로 머무는 이에게 아름다운 가치와 영감을 줍니다                주변정보전라감영 차량 2분전주한옥마을 차량 6분객사길 차량 7분기본정보입실 : 15:00 | 퇴실 : 11:0022시 이후 입실 시 사전문의 (필수)무료 WiFi전 객실 금연주차 가능객실정보개별 수영장 : 24시간 온수 무료인원 추가 정보1인 30 000원 (24개월 이상)   24개월 미만 무료영유아 인원수 포함   최대인원 초과불가침구 추가 : 예약 하루전만 가능 (무료)현장 결제펜션 서비스시설 이용문의 및 비용 별도 펜션문의상비약 구비짐보관 가능취소 및 환불 규정숙박일 기준 6일전 : 100% 환불숙박일 기준 5일전 : 90% 환불숙박일 기준 4일전 : 80% 환불숙박일 기준 3일전 : 70% 환불숙박일 기준 2일전 : 50% 환불숙박일 기준 1일전 : 30% 환불숙박일 당일 및 Noshow : 환불불가취소  환불 시 수수료가 발생할 수 있습니다확인사항 및 기타최대 인원 초과시 입실이 불가 합니다 (방문객 불가)객실 내 육류  튀김류  생선류 조리를 할 수 없습니다전 객실 애완동물 출입이 불가합니다보호자 동반없는 미성년자는 이용하실 수 없습니다해당 이미지는 실제와 상이 할 수 있습니다이용시설의 분실 및 훼손의 책임은 이용자에게 있으니 주의부탁드립니다객실 내에서는 화재위험물질 (화약  폭죽 등)은 사용 하실 수 없습니다 (화재로 인한 책임은 이용자에게 있습니다)쓰레기는 지정된 장소에 분리하여 주시기 바랍니다위의 정보는 펜션의 사정에 따라 변경될 수 있습니다성수기 기간동안 일부 객실의 경우 요금변동이 있을 수 있습니다수영장 운영은 날씨 또는 펜션 상황에 따라 변동 될 수 있습니다,7
 무주 흙집풍경펜션,전북 무주군 설천면 두길리 14271,7,펜션,//image.goodchoice.kr/resize_490x348/affiliate/2023/02/22/63f5c7ed8a75c.jpg,050214717631,사장님 한마디                    스키장 인근  계곡 바로 앞에 아름다운 정원이 있는 황토 힐링 펜션입니다불멍 체험  동물농장 체험  구들장 방 체험  개별 바비큐를 즐길 수 있습니다                주변정보덕유산리조트 차량 15분덕유산국립공원 차량 17분백련사 차량 26분기본정보입실 : 15:00 | 퇴실 : 11:0022시 이후 입실 시 사전문의 (필수)무료 WiFi전 객실 금연주차 가능펜션 픽업 (사전예약 및 문의필수)인원 추가 정보1인 10 000원 (24개월 이상~7세 미만)  15 000원 (7세 이상)영유아 인원수 포함   최대인원 초과불가현장 결제펜션 서비스시설 이용문의 및 비용 별도 펜션문의카페가마솥체험주방   식당카드결제 가능장아찌 무료제공불멍장소  트램펄린  미니키즈방  동물농장  휴게매점세탁기   건조기   전자레인지   상비약   기본양념 구비바비큐 시설숯+그릴 대여 : 2~4인 기준 20 000원  5~8인 기준 30 000원  9인 이상 40 000원이용시간 : 15:00~24:00개별 바비큐 가능현장 결제취소 및 환불 규정숙박일 기준 8일전 : 100% 환불숙박일 기준 7일전 : 80% 환불숙박일 기준 6일전 : 70% 환불숙박일 기준 5일전 : 60% 환불숙박일 기준 4일전 : 50% 환불숙박일 기준 3일전 : 40% 환불숙박일 기준 2일전 : 30% 환불숙박일 기준 1일전 ~ 당일 및 Noshow : 환불불가취소  환불 시 수수료가 발생할 수 있습니다확인사항 및 기타최대 인원 초과시 입실이 불가 합니다 (방문객 불가)객실 내 육류  튀김류  생선류 조리를 할 수 없습니다전 객실 애완동물 출입이 불가합니다보호자 동반없는 미성년자는 이용하실 수 없습니다해당 이미지는 실제와 상이 할 수 있습니다이용시설의 분실 및 훼손의 책임은 이용자에게 있으니 주의부탁드립니다객실 내에서는 화재위험물질 (화약  폭죽 등)은 사용 하실 수 없습니다 (화재로 인한 책임은 이용자에게 있습니다)쓰레기는 지정된 장소에 분리하여 주시기 바랍니다위의 정보는 펜션의 사정에 따라 변경될 수 있습니다성수기 기간동안 일부 객실의 경우 요금변동이 있을 수 있습니다,8
 부안 블랙하우스,전북 부안군 부안읍 동중리 120,8.9,모텔,//image.goodchoice.kr/resize_490x348/adimg_new/75049/522466/795a7445d274c40b3b4cc5c0c0a71bc2.jpg,050240516648,주차장 정보40대까지 가능해요.총 40대 주차시설 보유,9
 전주 비스트,전북 전주시 덕진구 금암동 4742,9.1,모텔,//image.goodchoice.kr/resize_490x348/adimg_new/1190/6637/283ec2661a3576c887abbb932c514951.jpg,050213912582,사장님 한마디                    전객실 넷플릭스  & 만화방 무료 운영중.게임을 좋아하는 연인들을 위해  배그2pc룸 (2pc + 기계식키보드 + 게이밍의자 + 로지텍마우스) 이젠 한방에 즐긴다 멀티 OTT룸(넷플릭스 티빙 웨이브 디즈니+ 왓챠)출장오신 분들을 위한 스타일러 룸 (LG스타일러!! 이젠 담배연기 안녕~~) 피시방보다 편한 배그1pc룸 (1pc + 기계식키보드 + 게이밍의자 + 로지텍마우스)  단순 숙박은 질린다!! 연인들을 위한 보드게임룸 (커플젠가  스플렌더  루미큐브  부르마블)당신의 피로를 날려줄 세라젬룸 공부하다 피곤하면 잠시 쉴수 있는 스터디룸  고전 게임을 즐기기 위한 오락실게임룸      OPEN !전객실 고사양PC 넷플릭스 대형욕조 킹배드 완비!!평일 무한대실은 만실시 조기 마감될수 있습니다.미성년자 체크로 인한 신분증 미지참 시 취소환불안됩니다.객실 기준인원은 2인  최대인원은 6인이며2인 이후부터는 현장에서 추가요금이 결제되오니 참고바랍니다!!!예약자 본인 이용이 원칙입니다.                혜택안내객실문에 부착된 여기어때 혜택마크를 찾아 QR코드로 혜택받으세요.주차장 정보정문 1층 주차장 시설을 갖추고 있습니다!!(1주차장 2주차장 총 40대 주차가능)발레파킹 서비스를 이용하실 수 있습니다(프론트로 문의)내부 주차 만차시 제2주차장을 이용하실 수 있습니다!총 40대 주차시설 보유객실내부 시설전 객실 대형스파욕조 완비전 객실 킹사이즈침대전 객실 넷플릭스 무료시청가능전 객실 고사양PC 완비!!!프런트 및 그 외 시설배그2PC룸 배그1PC룸 보드게임룸 스터디룸 스타일러룸 세라젬룸 OTT룸(넷플릭스 티빙 디즈니+ 웨이브 쿠팡플레이) 등 다양한 즐길거리 객실을 보유하고 있습니다!!!프론트에 다양한 먹거리와 물품 및 자판기가 완비되어 있습니다!!!,10
