Lodge_name,Lodge_address,Lodge_rate,Lodge_type,Lodge_RealImgName,Lodge_Tel,Lodge_content,Lodge_SellerInfo_BusinessNum
 쏠레르 호텔,충남 보령시 신흑동 22702,9.7,호텔,//image.goodchoice.kr/resize_490x348/affiliate/2023/10/12/65274258ad656.jpg,0419341111,사장님 한마디                    쏠레르는 태양이라는 뜻으로 서해 바다를 붉게 물들이는 태양의 기운을 담았습니다찬란하게 빛나는 낙조를 한눈에 담을 수 있는 객실과 각종 세미나와 워크숍 등 다양한 목적에 적합한 최신 시설을 갖추며 최상의 서비스를 제공합니다호텔 쏠레르는 항상 정성을 다하며 고객 만족을 최우선으로 하며 관광의 도시 보령에서 특별한 경험을 선사하겠습니다                주변정보대천역 차량 13분성주산자연휴양림 차량 24분보령호 차량 28분기본정보체크인 : 15:00 | 체크아웃 : 11:0022시 이후 체크인 시 호텔 프론트 문의무료 WiFi전 객실 금연Bath Amenity 미제공주차 가능 (무료)인원 추가 정보기준인원 외 추가 시  1인 10 000원 (5세 이상~성인)  5세 미만 무료침구 추가 : 1채당 20 000원침대 추가 : 33 000원영유아 인원수 포함   최대인원 초과 불가현장 결제투숙객 혜택짐 보관 가능프린트 이용 가능전 객실 넷플릭스 이용 가능 (개인 계정)비즈니스 센터 무료피트니스 센터 무료가습기 대여 가능 (단  재고 소진 시 대여 불가)인디언 텐트 렌탈 서비스 (재고 상황 및 이용 요금 호텔 문의)부대시설 정보키즈 라운지   1층   주중 10:00~19:00  주말 09:00~20:00   유료피트니스 센터   1층   00:00~24:00   개인 운동화  운동복 지참코인 세탁소   1층   00:00~24:00비즈니스 센터   1층   00:00~24:00조식 정보루미에르 레스토랑   2층   07:00~09:00 (마지막 입장: 08:30) 조식 뷔페 또는 단품 메뉴로 구성되며  호텔 사정에 따라 달라질 수 있습니다 (호텔 문의)현장 문의 및 결제석식 정보루미에르 레스토랑   2층   성수기 한정 운영 (2023년 운영 종료)   18:00~21:00 (마지막 입장: 20:30)   상설 세미뷔페 형식의 라이브 BBQ 뷔페 현장 문의 및 결제취사 시설전 객실 취사 불가취소 및 환불 규정체크인일 기준 5일 전 18시까지 : 100% 환불체크인일 기준 5일 전 18시 이후~4일 전 18시까지 : 80% 환불체크인일 기준 4일 전 18시 이후~3일 전 18시까지 : 60% 환불체크인일 기준 3일 전 18시 이후~2일 전 18시까지 : 20% 환불체크인일 기준 2일 전 18시 이후~체크인일 당일 및 Noshow : 환불 불가취소  환불 시 수수료가 발생할 수 있습니다확인사항 및 기타위의 정보는 호텔의 사정에 따라 변경될 수 있습니다미성년자는 보호자 동반 없이 이용이 불가합니다이미지는 실제와 상이할 수 있습니다체크인 시 배정 상품 또는 베드 타입이 미기재된 상품은 특정 객실과 베드 타입을 보장하지 않습니다객실가는 세금  봉사료가 포함된 금액입니다,9
 태안 칸,충남 태안군 태안읍 남문리 6384,10.0,모텔,//image.goodchoice.kr/resize_490x348/adimg_new/75730/536465/c13e328bb9c94531a475de15b966c70c.jpg,050440269634,사장님 한마디2023.08.29 GRAND OPEN                주차장 정보넓고 편리한 대형주차장 완비!실내  실외로 주차 가능하여 걱정 없이 방문 가능합니다!총 20대 주차시설 보유객실내부 시설전 객실 금연룸입니다.객실 사용시 불편사항은 언제든 프론트로 문의해 주시면 빠른 처리 해드리겠습니다.입실시 신분증을 확인하고 미성년자는 입실이 제한됩니다.언제나 고객님들의 편안한 쉼을 위해 노력하고 고민하는 칸 호텔입니다 ^^,10
 천안 제이탑호텔,충남 천안시 서북구 불당동 695,9.4,모텔,//image.goodchoice.kr/resize_490x348/adimg_new/5648/520817/82914f77d1d6c536f3e85326c4a8c38d.jpg,050440826988,사장님 한마디                    ▣ 객실 개별 난방으로 온도를 조절기 설치 추운 겨울 모든 객실 따뜻하게 이용가능합니다.▣ 코로나 19 바이러스 확산을 막기 위해 저희 호텔에서는 매일 수시로 소독하고 있습니다.▣ 호텔 로비에 손 소독제도 비치하여 안전하게 이용 가능합니다.▣ 저희 JTOP 호텔은 코로나 19 예방행동에 적극 동참 합니다.                주차장 정보주차장 지하1층  지하2층 외부주차장 동시주차 100대 가능총 100대 주차시설 보유객실내부 시설전 객실 TV 구비 완료	일부 객실 공기청정기 구비 완료	전 객실 드라이기 구비 완료	전 객실 고데기 구비 완료	전 객실 휴대폰충전기 구비 완료	전 객실 와이파이 구비 완료	전 객실 에어컨 구비 완료	전 객실 전기장판 구비 완료	전 객실 선풍기 구비 완료	전 객실 냉장고 구비 완료	전 객실 커피포트 구비 완료	전 객실 IPTV설치 구비 완료	일부 객실 비데 구비 완료	일부 객실 욕조 구비 완료	일부 객실 샤워부스 구비 완료	무인기 보유프런트 및 그 외 시설1층 로비 간단한 물과 음료제공지하 무인기 설치,1
 천안 더휴식 아늑호텔 천안역 1호점,충남 천안시 동남구 봉명동 524,9.9,모텔,//image.goodchoice.kr/resize_490x348/adimg_new/72314/514543/0fd5d6a90015e399957660ec8f6b6783.jpg,050240307823,사장님 한마디                    2022.10.13 New Grand Open  아늑 호텔  아늑한 공간  한번쯤 살아보고 싶은 그런 곳.밝고 따뜻한 디자인 톤으로 청결에 대한 우려를 해소하고 편안하고 친근하게 다가갑니다.포근하게 감싸 안기는 편안하고 조용한 분위기를 경험하는 나만의 아지트. 아늑 호텔은 고객의 경험을 최우선으로 생각합니다.                주차장 정보1객실 1주차입니다.궁금하신사항은 업체 문의연락 부탁드리겠습니다.총 10대 주차시설 보유지하철 정보1호선 천안역1호선 봉명역주변 정보천안역 차량 3분남산 중앙시장  차량 5분 천안 터미널& 고속버스터미널  신세계 백화점 차량7분천안역(KTX SRT 천안아산역) 차량 10분삼거리 공원  천안박물관  청수호수공원  천호지(단대호수)  차량 10분 단국대 천안캠퍼스  나사렛대학교  선문대 아산캠퍼스 차량 15분 독립기념관  테딘워터파크  유관순열사 기념관  천안 흑성산 전망대 차량 25분객실내부 시설▶ 유의사항 ◀아늑은 더휴식 프랜차이즈 호텔입니다.보다 쾌적한 환경을 제공해 드리기 위해 마라탕  청국장  홍어  대게등 일반적인 상식으로 향취가 강한음식은 객실 내 취식이 불가능 합니다.객실 내 음식반입 시 벽지손상에 주의해 주세요.금  토  일 그 외 공휴일을 경유하는 연박 예약은 30000원의 연박 비용이 발생합니다.미성년자는 이용이 제한되어 입실시에 신분증을 확인하오니 양해 부탁드립니다.부모님 동반 아닌 이상 미성년자 절대 입실 불가 하며 이에따른 취소 불가 합니다.남 여가 섞여서 3인이상은 이용불가  적발시 즉시 강제 퇴실 조치 합니다.모든 객실은 최대2인 입니다. 인원 추가 불가 합니다.(환불 불가)유아동반 시 미리 연락 주시면 감사드립니다.풍선이벤트하시는경우 (벽지 커튼에 테이프붙이면안됩니다.)과도한 손상 시 배상 책임은 고객님에게 있습니다.싱잉룸 노래방시설 이용시간은 10~23시까지 입니다.흡연 정보전 객실 금연 입니다.객실 내 흡연 시 퇴실일 숙박 요금 및 청소비를 청구 하오니 확인 부탁 드립니다.궁금하신 사항은 업체 문의번호 0415755525로 연락 부탁 드리겠습니다.추가 안내사항❣️OPEN❣️아늑캠프 루프탑 + 객실 랜덤 배정 PKG 체크인: 16시   체크아웃: 12시기준인원: 2명   최대인원: 4명(인원 추가비 1인당 30 000원 발생)아늑캠프 루프탑 이용시간: 16시~22시,2
 아산 저스트스테이호텔 아산시청점,충남 아산시 온천동 1303,9.9,모텔,//image.goodchoice.kr/resize_490x348/adimg_new/73056/489889/be0c6c16f2bca591646ddca2c89fdfdb.jpg,050440200306,사장님 한마디                    우리는 매일 숨 가쁘게 돌아가는 일상 속에서삶(LIFE)의 이유를 잊은 채 살아가고 있지는 않은가요?잠시나마 숨 가쁘게 돌아가는 일상을 떠나잠깐의 휴식(REST)에서 삶의 이유를 찾아보는건 어떨까요?NO REST  NO LIFE휴식 없이는 삶도 없습니다.                혜택안내요금할인주차장 정보주차는 1객실당 1대만 가능합니다.※만차 시 프론트에 문의 바랍니다.총 20대 주차시설 보유지하철 정보1호선 온양온천역주변 정보오시는길철도1호선 온양온천역 2km 차량 7분자동차남풍세IC 23km 차량 28분천안IC 23km 차량 40분남천안IC 27km 차량 34분버스기업은행  향군회관앞(510번  511번  512번) 도보 1분주변여행지아산시청 700m 도보 10분아산문화공원 1.3km 차량 4분온양민속박물관 1.3km 차량 5분아산환경과학공원 2.4km 차량 6분신정호국민관광지 2.6km 차량 7분아산곡교천야영장 3.4km 차량 7분창포군락지생태공원 3.7km 차량 9분곡교천시민체육공원 4km 차량 8분하늘도시자연공원 3.7km 차량 13분이순신종합운동장 4.7km 차량 11분민속마을체험장 8.7km 차량 20분송악저수지 11km 차량 19분객실내부 시설★AMENITY BRAND★DEAR. SLEEP은 좋은 잠자리에 영향을 미치는 매트리스  배게  침구류  토너  에멀전  욕실 어메니티 등 크고 작은 모든 품목을 직접 엄선하여 세팅합니다.DEAR. SLEEP은 JUST SLEEP이 만든 AMENITY&BEDDING 브랜드이며 좋은 잠자리를 위해 국내 외 기업들과 협업합니다.★입실인원 안내★전 객실 최대2인까지 입실 가능하며  무단으로 최대 입실인원을 초과하여 입실하는 경우  즉시 퇴실조치되며 객실비용은 환불 불가합니다.★신분증 확인 안내★미성년자 입실 및 사고방지를 위해 동행인을 포함한 모든 입실 고객님의 신분증 확인을 진행하고 있습니다.신분증 미소지시 입실이 불가능 할 수 있으며  이에 따른 객실비용 환불은 불가합니다.★전 객실 금연 안내★전 객실 금연이며  객실 내 흡연시 객실 정비 요금 100 000원이 부과됩니다.★연박 이용안내★연박 고객 大 환영연박 이용 관련하여 호텔로 문의주시면 상세하게 안내드리겠습니다.★전 객실 공통사항★넷플릭스  웨이브  유튜브 시청가능미세먼지 안심존(LG PuriCare(클리닝 필터교체))몰카안심존(전물 몰카 탐지키를 통한 객실 정비시 검사)Safety Seal(화장품 및 욕실용품 개별 개봉방지 시스템)세스코멤버스 ZONE(해충방제 솔루션)Free WiRi★타입별 스팩★스탠다드 : 퀸베드  65인치 TV  공기청정기프리미엄 무비 : 75인치 TV  욕조  공기청정기  퀸배드VIP : 65인치 TV  스파욕조  누하스 안마의자  공기청정기프런트 및 그 외 시설★기본 이용 규정★호텔 내 비품에는 도난방지 시스템이 설치되어 있습니다.촛불 사용이나 염색  물건 투척 등 파손이나 손괴 시 신고 및 변상 조치됩니다.사진과 다른 동일 타입의 객실로 배정될 수 있습니다.객실 컨디션 정비(청소)를 위해 입 퇴실 시간을 반드시 준수해주세요.외출 시 분실 위험이 있기에 가급적 카드키는 프런트에 보관해주세요.분실물 보관 시  미수령 분실물은 최대 4주 보관 후 폐기됩니다.애완동물 출입 불가합니다.★대여 및 기본 서비스★JUST DINING : 무료라면  LG스타일러  커피머신  전자레인지  얼음정수기  음료냉장고JUST BUSINESS : 복합기(인쇄  스캔  복사  팩스)이용가능JUST SHOPPING : 수면용품  코스매틱 등 구매가능(포인트 사용 가능)대여품목 : 고데기  롤빗  휴대폰충전기(프론트에 신분증 보관 후 무료로 대여 가능합니다.)기본구비 : 일회용 젓가락 숟가락  렌즈통  식염수  팬티라이너  구급의약품(필요 시 프런트에 요청 후 수령해주세요),3
 태안 청포대 수펜션,충남 태안군 남면 원청리 51815,7,펜션,//image.goodchoice.kr/resize_490x348/affiliate/2023/06/22/6493a4f20cbf3.jpg,050214861630,사장님 한마디                    대형 야외 수영장이 갖춰져 있는 신축 리모델링 펜션입니다청포대해수욕장에서 갯벌 체험을 즐기며 추억을 만들 수 있습니다                주변정보청포대해수욕장 차량 2분안면도쥬라기박물관 차량 6분태안빛축제 차량 9분공지사항예약 전화문의는 오전10시~오후7시까지이며 입실하신 고객님께는 입실 당일 야간 긴급 연락처를 메세지로 남겨드립니다안내실 OPEN시간은 오전10시~오후7시까지이니 추가로 필요하신 비품등은 마감시간 전에 요청바라며 오후7시 이후 도착하시는 고객님께서는 펜션에 사전 연락 바랍니다다음 이용객에게도 쾌적한 객실을 제공하기 위해 입실시 보증금 3만원(현금)이 청구되며 퇴실일에 객실점검후 오후3시 이전에 지정계좌 또는 퇴실시 현금 반환합니다.주말 공휴일 성수기에는 8인 이상 또는 객실 2개이상은 예약을 받지 않으니 이점 양해 바랍니다.(방문객포함) 성함을 다르게 하여 8인이상 단체예약시 현장에서 입실 및 환불이 불가합니다기준인원외 인원추가시(방문객포함) 7세미만(영아포함) 1인 2만원  7세이상 1인 2만원의 추가 요금이 발생하며 객실 최대인원을 넘기실수 없습니다객실 최대인원 초과시 (영.유아 방문객포함)입실이 불가하오니 이점 숙지하시고 예약하시기 바랍니다인원 추가비용  바베큐 그릴비용등은 입실시 안내실에 결제 바랍니다이불은 입실 인원수에 맞게 2인 1set 기준으로 제공되며 제공되는 이불외에 추가 이불을 원하실 경우 1set에 2만원 추가요금이 발생합니다애완동물(견 묘 조류 파충류포함) 동반시 펜션 입실이 불가하며 환불이 되지 않음을 알려드립니다코로나 환불관련 코로나19의 장기화로 인해 코로나도 생활속의 일부가 되었습니다저희 펜션에서는 코로나로 인한 환불.취소.변경등에 의한 운영상의 어려움을 극복하고자 코로나 관련 환불요청에도 독감과 동일한 기준으로 적용합니다이점 양해바라며 모두들 코로나에 걸리지 않도록 보건당국 지침과 개인위생에 신경써주시기바랍니다기본정보입실 : 15:00 | 퇴실 : 11:0022시 이후 입실 시 사전문의 (필수)IP TV WiF전 객실 금연주차 가능 (25대 주차 가능)인원 추가 정보1인 20 000원 (영유아 포함)영유아 인원수 포함   최대인원 초과불가침구 추가 : 1SET 20 000원현장 결제펜션 서비스시설 이용문의 및 비용 별도 펜션문의야외수영장운영 일자 : 매년 5월부터 9월까지(변동가능 펜션문의)이용 장소 : 펜션내 야외 수영장이용 요금 : 무료운영 시간 : 입실후~오후7시  오전9시~오전10시(청소시간:오전10시~정오)복 장 : 수영복  레쉬가드(평상복 불가)구비 항목 : 튜브  구명조끼 대여불가(에어 콤프레샤 구비)안전요원이 없으므로 아동 및 유아동반시 안전에 유의하시기 바라며 수영장은 음식물 반입이 불가하고 입수전 깨끗한 옷으로 환복한후 모래 및 몸을 씻고 입수 바랍니다.야외수영장 개장 기간에 펜션이용시 수건이 1인 1장씩만 제공되오니 여유분의 수건을 챙겨오시기 바랍니다기존 ) 갯벌체험 : 호미  바구니 무료대여변경 ) 갯벌체험(호미  바구니는  23년 7월 1일부터 무상 대여가 불가하며 유료 판매만 가능합니다)IP TV WiFi 객실에서 데이터 걱정 없이 빠르고 편리하게 인터넷을 즐겨보세요아동 유아 동반시 안전에 유의하시길 바랍니다바비큐 시설야외 개별테라스 바베큐 가능바베큐 그릴set(숯+석쇠+그릴1개) 2인~4인 원형그릴 1set 20 000원(4인 초과시 1인당5 000원 추가요금)이용방법: 입실시 안내실에서 결재하시면 바베큐그릴set와 토치를 드리며 원하시는 시간에 원하시는 장소에서 직접 불을 붙여 사용하시고 사용하신 그릴은 안내실에 반납해 주시면 됩니다오후7시이후 입실고객은 펜션에 사전 예약 문의바랍니다바베큐 이용시 유의사항우천시 또는 겨울철에는 차양 및 가림막이 되어 있지 않아 객실 및 야외테이블에서 개별 바베큐가 불가할수 있으며 실내공용 바베큐장을 이용하셔야 합니다그릴set 추가 요청시 1개에 20 000원의 추가요금이 발생합니다자이글 대여(우천시에만 대여가능)실내 이용가능한 자이글 대여 1박 15 000원이용방법: 입실시 안내실에서 결제후 자이글을 받아가셔서 사용하신후에 다음분이 사용에 지장이 없도록 기름통정리 및 설거지를 하여 다음날 오전 11시까지 안내실에 반납해주시면 됩니다.(연박 고객의 경우 미반납시 추가요금이 발생합니다)오후8시이후 입실고객은 펜션에 사전 예약 문의개인이 가져오시는 숯 그릴 장작 전기그릴 난로등은 반입이 불가하며 객실내에서 고기 생선구이 또는 수산물찜등은 금지되어있습니다취소 및 환불 규정숙박일 기준 10일전 : 100% 환불숙박일 기준 9~7일전 : 90% 환불숙박일 기준 6일전 : 80% 환불숙박일 기준 5일전 : 60% 환불숙박일 기준 4일전 : 40% 환불숙박일 기준 3일전 : 20% 환불숙박일 기준 2일전 : 10% 환불숙박일 기준 1일전~당일 및 Noshow : 환불불가취소  환불 시 수수료가 발생할 수 있습니다확인사항 및 기타최대 인원 초과시 입실이 불가 합니다 (방문객 불가)객실 내 육류  튀김류  생선류 조리를 할 수 없습니다전 객실 애완동물 출입이 불가합니다보호자 동반없는 미성년자는 이용하실 수 없습니다해당 이미지는 실제와 상이 할 수 있습니다이용시설의 분실 및 훼손의 책임은 이용자에게 있으니 주의부탁드립니다객실 내에서는 화재위험물질 (화약  폭죽 등)은 사용 하실 수 없습니다 (화재로 인한 책임은 이용자에게 있습니다)쓰레기는 지정된 장소에 분리하여 주시기 바랍니다위의 정보는 펜션의 사정에 따라 변경될 수 있습니다성수기 기간동안 일부 객실의 경우 요금변동이 있을 수 있습니다수영장 운영은 날씨 또는 펜션 상황에 따라 변동 될 수 있습니다,4
 신라스테이 천안,충남 천안시 서북구 성정동 1430,9.3,호텔,//image.goodchoice.kr/resize_490x348/affiliate/2019/02/27/5c7630c49a3fd.jpg,0414159000,사장님 한마디                    대한민국 교통의 요충지이자  수도권과 충남지역의 문화  예술  산업을 잊는 통로 천안에 위치하고 있습니다KTX 천안아산역과 천안종합터미널  천안 IC와 인접해 수도권 및 다른 지역으로 접근성이 뛰어납니다독립기념관  천안삼거리  온양온천 등 대표하는 관광지로의 이동이 쉬우며  산업단지와도 인접해 비즈니스 고객에게 최적의 선택이 될 것입니다                주변정보KTX천안역 15분천안역 차량 10분천안종합버스터미널 차량 5분기본정보체크인 : 15:00 | 체크아웃 : 12:00무료 WiFi전 객실 금연Bath Amenity (치약  칫솔 제외)[주차 안내]주차 공간 제한으로 인하여 가급적 대중교통 이용해 주시기 바랍니다주차 가능 ( 1박 당   차량 1대 당 5 000원)인원 추가 정보전 객실 인원추가 불가투숙객 혜택피트니스 센터 : 투숙객 무료 (안전상의 이유로 16세 이상 입장 가능)비즈니스 코너 : 투숙객 무료무료 커피  티백무료 생수 2병 (1박 기준)부대시설 정보레스토랑Bar피트니스 센터   운영 잠정 중단비즈니스 코너세탁실라운지   3층   18:00~23:00 (라스트오더 22:30)조식 정보조식 레스토랑   1층   06:30~09:30 (주중)  07:00~10:00 (주말   공휴일)1인 15 000원 (37개월~13세)  28 000원 (14세~성인)37개월 미만 무료취소 및 환불 규정체크인일 기준 1일전 18시까지 : 100% 환불체크인일 기준 1일전 18시이후~당일 : 환불불가취소  환불시 수수료가 발생할 수 있습니다확인사항 및 기타만 19세 미만은 투숙 불가합니다실명으로만 예약 및 체크인 가능합니다최대인원 초과시 입실 불가합니다내국인 전용상품으로 외국인은 투숙이 불가능합니다외국인에 경우 국내거주증 소지자에 한하여 투숙 가능 합니다위의 정보는 호텔의 사정에 따라 변경될 수 있습니다해당 이미지는 실제와 상이 할 수 있습니다체크인 시 배정 또는 베드타입 미기재 상품은 특정객실과 베드타입을 보장하지 않습니다해당 객실가는 세금  봉사료가 포함된 금액입니다미성년자는 보호자 동반없이 이용하실 수 없습니다,5
 코트야드 메리어트 세종,세종 어진동 647,9.6,호텔,//image.goodchoice.kr/resize_490x348/affiliate/2023/08/01/64c8c54ae3fb7.jpg,0442514000,사장님 한마디                    코트야드 세종은 대한민국 세종시 최초의 메리어트 인터내셔널 호텔로  서울에서 단 50분 거리에 위치해 편리한 접근성을 자랑합니다통유리 창을 통해 탁 트인 세종 호수공원과 세종시 일대를 조망할 수 있는 객실을 갖추고 있습니다                주변정보세종고속터미널 차량 10분세종호수공원 도보 7분국립공주박물관 차량 29분기본정보체크인 : 15:00 | 체크아웃 : 12:0022시 이후 체크인 시 호텔 프론트 문의무료 WiFi전 객실 금연Bath Amenity (치약  칫솔 무료)무료 주차 (객실 당 1대)인원 추가 정보기준인원 외 추가 시  1인 55 000원 (만 13세 이상~성인)  만 12세 이하 무료침구 추가 불가침대 추가 : 55 000원영유아 인원수 포함   최대인원 초과 불가현장 결제투숙객 혜택피트니스 투숙객 무료프린터 이용 가능짐 보관 가능전 객실 넷플릭스 이용 가능 (개인 계정)부대시설 정보피트니스   20층   00:00~24:00   개인 운동복 및 운동화 지참  16세 미만 출입 불가세종키친   1층   월~금: 중&석식 단품 메뉴  토~일: 중&석식 뷔페 운영 (뷔페 미운영 시간 14:00~18:00 시간 내 단품 식사 가능)   사전예약 필수주말(토~일) 뷔페 운영: 중식 11:30~14:00  석식 18:00~21:00   성인 99 000원  소인 69 000원 (1인 기준)세종카페   1층   14:00~17:30   애프터눈 티 세트 88 000원 (2인 기준)   사전예약 필수세종라운지   20층   18:00~21:00   이브닝라운지 운영기간: ~2023년 9월 3일   무제한 생맥주  20종의 스낵류 및 드링크 제공 49 000원 (1인 기준)    사전예약 필수조식 정보세종키친   1층   06:30~10:001인 38 000원 (만 13세 이상~성인)  25 000원 (만 3세 이상~만 12세 이하)  만 3세 미만 무료현장 결제취사 시설전 객실 취사 불가취소 및 환불 규정체크인일 기준 1일 전 18시까지 : 100% 환불체크인일 기준 1일 전 18시 이후~당일 및 Noshow : 환불 불가취소  환불 시 수수료가 발생할 수 있습니다아래 객실은 별도의 취소 규정이 적용되오니 참고 부탁드립니다[오프닝 한정 특가] 객실 : 예약 후 취소  변경  환불 불가확인사항 및 기타위의 정보는 호텔의 사정에 따라 변경될 수 있습니다미성년자는 보호자 동반 없이 이용이 불가합니다이미지는 실제와 상이할 수 있습니다체크인 시 배정 상품 또는 베드 타입이 미기재된 상품은 특정 객실과 베드 타입을 보장하지 않습니다객실가는 세금  봉사료가 포함된 금액입니다,6
