Lodge_name,Lodge_address,Lodge_rate,Lodge_type,Lodge_RealImgName,Lodge_Tel,Lodge_content,Lodge_SellerInfo_BusinessNum
 태안 썬스톤풀빌라,충남 태안군 남면 진산리 5716,7,펜션,//image.goodchoice.kr/resize_490x348/affiliate/2023/04/14/6438fdf28b5db.jpg,050440123271,사장님 한마디                    태안 최고의 오션뷰에 전 객실 리모델링으로 품격을 더한 풀빌라입니다공용수영장  개별수영장  야외바비큐장  캠프파이어 등 즐길 수 있습니다                주변정보팜카밀레 차량 11분몽산포해수욕장 차량 14분청포대해수욕장 차량 17분기본정보입실 : 15:00 | 퇴실 : 11:0020시 이후 입실 시 사전문의 (필수)무료 WiFi전 객실 금연주차 가능객실정보자쿠지 : 골드스톤102호  사파이어101호  스타루비101호  스타루비201호  크리스탈VIP 이용 가능개별수영장 (사계절 운영) : 골드스톤101호  골드스톤SKY1  골드스톤SKY2  에메랄드101호  카넬리안101호  카넬리안201호 이용 가능온수 추가 : 에메랄드 객실 100 000원 외 객실 70 000원 (미온수 25도 유지)  15:00 ~ 21:00  수영복 및 자유복장인원 추가 정보1인 20 000원 (24개월 이상~13세 미만)  30 000원 (13세 이상)연박 예약 시 1박당 비용 발생숙박하지 않는 방문객 또한 위 금액과 동일한 비용이 발생24개월 미만의 경우  추가 요금은 발생하지 않으나 기준‧최대인원에는 포함영유아 인원수 포함   최대인원 초과불가최대 인원을 초과하는 경우  퇴실 조치가 이루어질 수 있음침구 추가 : 가능현장 결제펜션 서비스시설 이용문의 및 비용 별도 펜션문의야외 수영장 (하절기 운영) : 6월 4일 ~ 9월 2일  무료  15:00 ~ 21:00  수영복 및 자유복장캠프파이어 : 전 객실 가능  비용 30 000원 (참숯 10kg  오로라 가루 1case)  개인 화기 반입 금지카드결제 가능실내 한옥 休공간세탁기   탈수기   상비약바비큐 시설숯+그릴 대여 : 2~4인 기준 30 000원  5~7인 기준 40 000원  8~10인 기준 50 000원가스그릴 : 골드스톤SKY1  골드스톤SKY2  골드스톤201호  골드스톤202호 이용 가능이용시간 : 15:00~23:00현장 결제취소 및 환불 규정숙박일 기준 6일전 : 100% 환불숙박일 기준 5일전 : 90% 환불숙박일 기준 4일전 : 80% 환불숙박일 기준 3일전 : 70% 환불숙박일 기준 2일전 : 50% 환불숙박일 기준 1일전 : 30% 환불숙박일 당일 및 Noshow : 환불불가취소  환불 시 수수료가 발생할 수 있습니다확인사항 및 기타최대 인원 초과시 입실이 불가 합니다 (방문객 불가)객실 내 육류  튀김류  생선류 조리를 할 수 없습니다전 객실 애완동물 출입이 불가합니다보호자 동반없는 미성년자는 이용하실 수 없습니다해당 이미지는 실제와 상이 할 수 있습니다이용시설의 분실 및 훼손의 책임은 이용자에게 있으니 주의부탁드립니다객실 내에서는 화재위험물질 (화약  폭죽 등)은 사용 하실 수 없습니다 (화재로 인한 책임은 이용자에게 있습니다)쓰레기는 지정된 장소에 분리하여 주시기 바랍니다위의 정보는 펜션의 사정에 따라 변경될 수 있습니다성수기 기간동안 일부 객실의 경우 요금변동이 있을 수 있습니다수영장 운영은 날씨 또는 펜션 상황에 따라 변동 될 수 있습니다,4
 공주 모텔 산,충남 공주시 신관동 59716,9.4,모텔,//image.goodchoice.kr/resize_490x348/adimg_new/75287/528203/404d76c3941174f56db95dea302d7f0f.jpg,050240163618,사장님 한마디                    2023년 7월 리모델링하여 오픈한 공주 모텔 산입니다.항상 청결하고 편안한   모텔 산  이 되겠습니다. 감사합니다.  산이 그리워  산에 머문다                  주차장 정보객실당 차량은 1대만 주차 가능합니다. 1대 이상 주차는 프런트에 꼭 가능 여부 문의해주세요.주차자리가 없을 경우  이중주차 하시고 키를 프런트에 맡겨주세요.총 15대 주차시설 보유주변 정보공주터미널 도보 5분공주대학교 차량 5분공산성 차량 5분공주 무령왕릉 차량 5분공주 한옥마을 차량 10분객실내부 시설스페셜 객실(4층  엘리베이터 없음)전 객실 금연객실입니다.전 객실 허리가 편안한 폼매트리스 구비전 객실 55인치 스마트TV 구비(UHD  4K  돌비)전 객실 기가 와이파이 구비전 객실 에어컨 구비전 객실 무소음 냉장고 구비전 객실 커피포트 구비전 객실 테이블 및 의자 구비전 객실 드리이기(비달사순) 구비전 객실 어메니티 구비전 객실 거울 구비일부 객실 욕조 구비프런트 및 그 외 시설건물 앞 주차장 외  모텔 산 전용 실외 주차장 있습니다.추가 안내사항엘리베이터가 없는 건물입니다.(그래서 운동하기 좋아요!)추가인원 1인 10 000원(침구류 포함)의 추가비용이 발생됩니다.전 객실 금연   흡연 적발시 환불없이 강제퇴실 조치 및 정비요금을 요청할 수 있습니다.입실시간이 21시 이후가 될 경우  모텔로 연락 부탁드립니다.성수기 및 특정일  공휴일에는 요금변동이 있을 수 있습니다.입실시간 전  1층 프런트에 짐 보관 가능합니다.지정한 입 퇴실시간 미 준수 시  별도의 추가요금이 발생됩니다.반려동물   미성년자   남녀 3인 이상 혼숙을 금지하고 있습니다.동숙으로 입실 후 혼숙을 하실 경우 환불없이 즉시 퇴실 및 형사고발 조치될 수 있습니다.연박 객실 청소는 고객님 외출 혹은 요청시에 해드리고 있습니다. 청소를 원하는 고객은 미리 말씀 부탁드립니다.분실물 1개월 보관 후 폐기합니다.,5
 천안 브라운도트천안터미널점,충남 천안시 동남구 신부동 4699,9.9,모텔,//image.goodchoice.kr/resize_490x348/adimg_new/1039/291275/584a6db4823df204f04a72b89b1971b8.jpg,050240486351,사장님 한마디                    [Yanolja brand Browndot HOTEL 천안 터미널점]브라운도트 호텔은 일상에서 벗어나 감성을 자극할 수 있는 공간을 선사합니다.감성적이고 세련된 디자인의 객실에서 평범한 일상을 특별한 순간으로 만들어 보세요!브라운도트 호텔 천안터미널점은 감성적인 객실 인테리어와 호텔식 침구류를 통해  잠시 휴식이 필요한 고객님들께 최상의 공간을 제공하고자 합니다.천안  그리고 우리 신부동의 자랑거리로 남고 싶습니다.혜택안내객실문에 부착된 여기어때 혜택마크를 찾아 QR코드로 혜택받으세요.주차장 정보2인1실 기준으로 최대 차량 1대 주차 가능합니다.총 1대 주차시설 보유지하철 정보1호선 두정역1호선 천안역주변 정보천안 IC 1km 5분 거리천안 버스터미널 700M 차량 1분 거리천안 독립기념관 차량 12KM 12분 거리천안역  천안터미널  신세계백화점  천안삼거리공원  홍대용과학관  독립기념관  아라리오갤러리  각원사  유관순열사 사적지  병천 순대거리  우정힐스CC  세종에머슨CC  프린세스골프클럽  아산CC  천안골프클럽  신부동객실내부 시설전 객실 시몬스 뷰티레스트  KC인증 100% 고급 킹사이즈 침대전 객실 100% 순면 60 수 고급 린넨+KC 인증 최고급 오리털 이불 제공전 객실 LG 70인치 SMART TV   넷플릭스+디즈니   시청 가능전 객실 개별 LG 냉 난방 시스템 에어컨전 객실 무선 충전기 설치  객실 내 개별 WIFI 사용 가능전 객실 VOVO 일체형 비데전 객실 금연 객실공기청정기 비치프리미엄 객실 이상 네스프레소 머신 및 캡슐 제공프리미엄 객실 이상 삼성 에어드레서프런트 및 그 외 시설☆ 1층 로비  스타벅스 원두 커피 제공(오전 토스트 이용 가능) 에이드  음료  제빙기 이용 가능 LG 워시타워(세탁기 건조기) 사용가능☆ 7층 디럭스 전용 테라스  9층 전용 테라스추가 안내사항⭐애견 동반천안시 부띠끄 애견동반 호텔펫 동반관련 안내사항 현재 기재된 상품들은 펫동반이 불가한 상품입니다. 펫 동반시 업장으로 유선상 문의 해주시면 입실가능한 객실을 별도로 안내해드립니다.(참고 펫동반시 마리당 추가요금 3만원  최대 2마리까지 가능)미리예약시 전화문의 부탁드립니다.,6
 천안 아늑호텔 성정점,충남 천안시 서북구 성정동 1462,9.9,모텔,//image.goodchoice.kr/resize_490x348/adimg_new/1288/589/e56abf2b4089be235cafa86f5da85107.jpg,050213946665,사장님 한마디                    아늑호텔은 원래 낡고 오래된 모텔이었습니다.저희는 모텔을 매입하고  깔끔한 인테리어  다양한 컨텐츠  더 나은 휴식을 위한아이템들을 더해 새로운 형태의 <콘텐츠 호텔>로 만들어 가고 있습니다.객실에서는 영화  플레이스테이션  음악 등 20종 이상의 컨텐츠를 경험할 수 있고 로비에는 평소 써보고 싶었던 제품들을 체험해볼 수 있는 공간을 마련해놨습니다.또 전문적인 교육을 받은 직원이 체계 잡힌 응대 서비스를 제공하고 여러분이 머무는 공간의 청결 상태를 책임집니다.아늑호텔의 모든 객실에서 넷플릭스 무료 서비스  크리에이터들의 작품이 담긴 액자 더 나은 휴식을 위해 아늑호텔이 직접 개발한 고이고이 침구류와 어메니티를경험해 보실 수 있습니다..                주차장 정보건물 주차장 11대타워주차장 16대외부주차장 다수 가능총 40대 주차시설 보유지하철 정보1호선 두정역1호선 천안역주변 정보⭐ 두정동 먹자골목 인근 위치⭐ 두정역 도보 5분이내 위치⭐ 천안 제3산업단지에서 차량 5분거리에 위치⭐ 두정동 경마장 도보2분이내 위치⭐ 천안역 차량 5분거리에 위치⭐ KTX 천안아산역 차량10분거리에 위치⭐ 천안고속버스 터미널 차량 5분거리에 위치⭐ 우정힐스 CC 차량 20분거리에 위치⭐ 천안 축구센타 차량 5분거리에 위치객실내부 시설❣️STANDARD_개인 계정 없이 OTT 서비스 무료 이용 (넷플릭스 시청가능)✔아늑함  청결함  쾌적함만 남긴 스탠다드룸에서 휴식을 즐겨보세요.❣️SAUNA_2인용 사우나 부스   섬세이 에어드라이기   주차가능   넷플릭스 무료✔프라이빗한 공간에서 시원한 사우나 후 에어드라이기로 쾌적한 하루를 보내세요.❣️GOLF_비전홈 골프 시뮬레이터   빔프로젝트 80     TV 65     주차가능   넷플릭스 무료✔넓고 프라이빗한 공간에서 골프 게임을 즐겨보세요❣️YOGA_안다르 요가용품 SET   인센스 홀더   주차가능   넷플릭스 무료✔안다르 요가 용품과 인센스 향을 통해 마음을 비워보세요.❣️MOVIE_전동 리클라이너 체어   빔프로젝트 80     주차가능   넷플릭스 무료✔리클라이너에 누워서 빔프로젝트로 영화를 즐겨보세요.❣️BUSINESS_LG 트롬 스타일러 3벌용   필립스 27   모니터   주차가능   넷플릭스 무료✔일하기 좋은 책상에서 업무와 창작 활동에 집중해보세요.❣️MEDITATION_다도체험 세트   주차가능   넷플릭스 무료✔차판  숙우  티팟 등을 통해 다도체험을 경험해보세요.❣️MAKE UP_다이슨 에어랩 세트   주차가능   넷플릭스 무료✔다이슨 에어랩을 사용하여 기분좋은 아침을 맞이해보세요.❣️PLAY_PS4   리클라이너 체어   주차가능   넷플릭스 무료✔PS4 콘솔게임을 연인  친구와 마음껏 즐겨보세요.❣️2PC_RTX3070  32   모니터 (240Hz) 고사양 PC 2대   주차가능   넷플릭스 무료✔고사양 게이밍 PC 2대로 밤새도록 게임을 즐겨보세요.❣️READING_만화책(슬램덩크)   매거진(바이오그래피)   에세이(무라카미하루키)   소설(애드거앨런포)   주차가능   넷플릭스 무료✔편안한 공간에서 다양한 종류의 도서를 읽으며 다양한 학문을 넓혀보세요.❣️MUSIC_마샬 액톤3 브라운   주차가능   넷플릭스 무료✔하이엔드 마샬 스피커와 함께 최상의 음악과 휴식을 경험해보세요.❣️DINING TWIN_2BED (Q사이즈)   쿠잉 와인셀러   와인잔 6EA   전동 와인오프너   주차가능   넷플릭스 무료✔맛있는 음식과 와인을 즐길 수 있는 최상의 공간에서 파티를 즐겨보세요.❣️MOVIE SWEET_2BED (Q사이즈)   빔프로젝트 100     23인용 소파   주차가능   넷플릭스 무료✔나만의 프라이빗한 공간에서 영화를 마음껏 즐겨보세요.❣️아늑맨션  다락방_2BED (Q사이즈)   1F (빔프로젝트 80    주방  다이닝)   다락방 (빔프로젝트 80    65  TV  다도 체험세트  Q사이즈침대)   주차가능   넷플릭스 무료✔1층에서는 즐거운 식사를  다락방에서는 영화감상  다도체험 등 다양한 컨텐츠를 즐겨보세요.❣️MUSIC TWIN_2BED (Q사이즈)   무인양품 벽걸이 블루투스스피커   고급 티팟세트   주차가능   넷플릭스 무료✔나란히 누워 블루투스 스피커를 통해 서로의 음악을 공유해보세요.❣️WINE&READING_2BED (Q사이즈)   다이닝존 (와인세트)   리딩존(도서세트)   주차가능   넷플릭스 무료✔공간 한켠에서는 다양한 도서를 즐기고  한켠에서는 맛있는 식사와 와인을 즐겨보세요.❣️아늑맨션  복층_2BED (Q사이즈)   마샬 액톤3 브라운   냉장고  전자렌지   다도세트   주차가능   넷플릭스 무료✔1층에서는 하이앤드 마샬스피커와 즐거운 식사를  복층에서는 다도체험을 즐겨보세요.추가 안내사항✔전 객실 금연 입니다. 객실 내부나 화장실에서 연초 흡연 시 청소 비용 부과되며 근처 객실에서 흡연 행위에 대한 항의로 인하여 적발 될 시 환불 없이 바로 퇴실 조치 되십니다. 아늑을 찾아주시는 모든 손님들께서 편안히 머물다 가시기 위한 호텔 규정 입니다. 반드시 연초 흡연은 건물 외부에서 부탁 드립니다.✔미성년자는 이용이 제한되어 입실 시에 신분증을 확인하오니 양해 부탁 드립니다.부모님 동반 아닌 이상 미성년자 분들은 절대 입실 불가✔기준 인원 초과 시 1인 2만원 발생합니다.최대 인원 외에 절대 입실 불가.(환불불가) 유아 동반 시 미리 연락 주세요. 남 여가 섞여서 3인 이상은 이용 불가합니다..✔객실요금은 2인 1실 기준(1~2인이하)이며  인원이 초과 시에는 추가 요금이 가산 됩니다.✔풍선이벤트하시는경우 (벽지 커튼에 테이프붙이면안됩니다.) 객실 내 음식 반입시 벽지 손상에 주의해 주세요.(손상시 배상요구) 과도한 손상 시 배상 책임은 고객 님에게 있습니다✔객실은 숙박이외의 목적으로 사용할수 없으며 다른 손님에게 피해를 주는 소란은 삼가하여 주시기 바랍니다.,7
 태안 연포해변앞 펜션,충남 태안군 근흥면 도황리 152691,7,펜션,//image.goodchoice.kr/resize_490x348/affiliate/2023/05/22/17/3mb6OiptqT5h.jpg,18339306,사장님 한마디                    서해안의 아름다운 해변 연포해수욕장 앞에 있는 펜션입니다시원한 바닷바람과 낙조를 보며 바비큐 파티를 즐기실 수 있습니다                주변정보연포해수욕장 도보 2분청산수목원 차량 30분몽산포해수욕장 차량 30분기본 정보입실 : 15:00 | 퇴실 : 11:0021시 이후 입실 시 사전문의 (필수)조기입실 1시간 10 000원   늦은퇴실 1시간 15 000원 추가요금 발생무료 WiFi전 객실 금연주차 가능 (객실당 1대)인원 추가 정보1박기준 1인당 15 000원 (24개월 이상)   1박 기준영유아 인원수 포함   최대인원 초과불가현장 결제애견 입실안내애견동반을 원할 경우 사전 문의 및 상담 필수1마리당 20 000원 (5kg 미만  소형견종만 가능)최대 2마리 동반입실 가능현장 결제펜션 서비스시설 이용문의 및 비용 별도 펜션문의야외 수영장 (하절기 운영)바비큐 시설숯+그릴 대여 : 4인 기준 20 000원  5~7인 기준 30 000원  8인 이상 40 000원 (연탄  테이블  식탁 포함)준비시간 : 12:00~21:00이용시간 : ~23:00숯  그릴 개인지참 불가능현장 결제취소 및 환불 규정숙박일 기준 10일 전 : 100% 환불숙박일 기준 9일 전 : 90% 환불숙박일 기준 8일 전 : 80% 환불숙박일 기준 7일 전 : 70% 환불숙박일 기준 6일 전 : 60% 환불숙박일 기준 5일 전 : 50% 환불숙박일 기준 4일 전 : 40% 환불숙박일 기준 3일 전 : 30% 환불숙박일 기준 2일 전 : 20% 환불숙박일 기준 1일 전 : 10% 환불숙박일 기준 당일 및  NOSHOW : 환불불가취소 및 환불시 수수료가 발생할 수 있습니다확인사항 및 기타최대 인원 초과시 입실이 불가 합니다 (방문객 불가)객실 내 육류  튀김류  생선류 조리를 할 수 없습니다보호자 동반없는 미성년자는 이용하실 수 없습니다해당 이미지는 실제와 상이 할 수 있습니다이용시설의 분실 및 훼손의 책임은 이용자에게 있으니 주의부탁드립니다객실 내에서는 화재위험물질 (화약  폭죽 등)은 사용 하실 수 없습니다 (화재로 인한 책임은 이용자에게 있습니다)쓰레기는 지정된 장소에 분리하여 주시기 바랍니다위의 정보는 펜션의 사정에 따라 변경될 수 있습니다성수기 기간동안 일부 객실의 경우 요금변동이 있을 수 있습니다수영장 운영은 날씨 또는 펜션 상황에 따라 변동 될 수 있습니다,8
 [반짝특가] 메리머드 호텔,충남 보령시 신흑동 22732,9.3,호텔,//image.goodchoice.kr/resize_490x348/affiliate/2019/10/22/5dae66ff4eb97.jpg,0419333366,사장님 한마디                    연간 1 000만명 이상의 관광객이 찾아오는 대천 해수욕장을 한눈에 내다볼 수 있는 오션뷰를 자랑하는 호텔입니다전 객실 테라스형 오션뷰  신축건물  감성적이고 안정적인 인테리어를 보유한 호텔입니다                주변정보대천해수욕장 앞대천항 차량 3분대천마스타워터파크 차량 3분기본정보체크인 : 15:00 이후 | 체크아웃 : 11:00 이전얼리체크인 레이트체크아웃 : 1시간 당 15 000원(11시 이전  15시 이후 1박 요금 부과)무료 WiFi전 객실 금연Bath Amenity (치약  칫솔 무료   비데  커피포트 일회용슬리퍼 구비)주차 가능 (무료)주차장 만차 시 무료 공영주차장(도보 3분) 이용 가능인원 추가 정보기준인원 외 추가 시  1인 20 000원 (7세 이상~성인)  7세 미만 무료침구 추가 : 인원 추가 비용에 포함 7세 미만 인원수 미포함   최대인원 초과불가현장 결제투숙객 혜택생수 2병 제공 아기 침대 (신생아용)  아기욕조 무료 대여 서비스 (사전요청 시  구비 수량 소진 시 대여 불가)부대시설 정보Cafe (카페테리아)   1층   08:00~21:00브런치&디너 메뉴   10:00~21:00   9 900원부터베이커리 : 10:00~17:00호텔 사정에 따라 임의로 변경되오니 프런트에 문의 부탁 드립니다상기 금액은 부가세 10%(VAT) 포함 금액입니다취사 시설전 객실 취사 불가취소 및 환불 규정체크인일 기준 2일 전 : 100% 환불 체크인일 기준 1일 전~ 당일 및 Noshow : 환불불가취소  환불시 수수료가 발생할 수 있습니다아래 객실은 별도의 취소 규정이 적용되오니 참고 부탁드립니다[반짝특가]  [선착순 특가] 객실: 예약 시 취소  변경  환불 불가확인사항 및 기타최대 인원 초과 시 입실 불가합니다미성년자는 보호자 동반없이 이용이 불가합니다위의 정보는 호텔의 사정에 따라 변경될 수 있습니다해당 이미지는 실제와 상이 할 수 있습니다체크인 시 배정 또는 베드타입 미기재 상품은 특정객실과 베드타입을 보장하지 않습니다해당 객실가는 세금  봉사료가 포함된 금액입니다반려동물 출입이 금지되어 있습니다객실 내 흡연이 금지되어 있습니다,9
 천안 벨리노,충남 천안시 서북구 성정동 7427,9.6,모텔,//image.goodchoice.kr/resize_490x348/adimg_new/4432/25160/2d239a88241eeeaddb03e26843795048.jpg,050448812945,사장님 한마디                    ❣️전 객실 넷플릭스 사용가능❣️❣️벨리노 호텔은 좋은 잠자리 제공을 최우선 원칙으로 합니다. ❣️                혜택안내요금할인객실문에 부착된 여기어때 혜택마크를 찾아 QR코드로 혜택받으세요.주차장 정보대형 주차공간 완비 (내부20대 주차공간)외부 주차공간 별도 운영총 20대 주차시설 보유지하철 정보1호선 천안역1호선 봉명역주변 정보천안 서부역 5분 거리 위치비즈니스 고객분께서도 편안하게 이용 하실 수 있습니다.객실내부 시설⭐천안 벨리노 객실 정보⭐❣️전 객실 대형 TV 구비 완료❣️전 객실 넷플릭스 시청 가능❣️전 객실 고데기 및 드라이어기 구비 완료❣️전 객실 핸드폰 충전기 구비 완료(아이폰 c타입 안드로이드)❣️전 객실 진동 헤드셋 대여 가능 (카운터 문의)❣️전 객실 WiFi 설치 완료❣️전 객실 어메니티 제공디럭스 TYPE : 1PC(일체형 PC)프리미엄 TYPE : 1PC(오버워치 LOL 가능)  스타일러 구비테라스 TYPE : 객실 내 테라스  1PC(오버워치  LOL 가능)  스타일러  공기청정기 구비디럭스 2PC TYPE : 2PC(배틀그라운드 가능)테라스 2PC TYPE : 객실 내 테라스  2PC(배틀그라운드 가능)  전자레인지 구비VIP TYPE : 1PC(오버워치  LOL 가능)  안마의자  스타일러  공기청정기 구비프런트 및 그 외 시설⭐천안 벨리노 객실 외 시설정보⭐❣️객실 통로 전자레인지 구비 완료❣️렌즈통  렌즈세정액 무료지급 (카운터 문의)❣️로비 무한 프린터 & 팩스 이용 가능❣️로비 스낵바 운영ㄴ 과자  팝콘  커피머신추가 안내사항❣️테라스  VIP 객실 숙박이용시 고객 전원 봉지라면 무료서비스❣️모든 객실은 2인기준이며 인원추가시 현장문의 부탁드립니다.,10
