Lodge_name,Lodge_address,Lodge_rate,Lodge_type,Lodge_RealImgName,Lodge_Tel,Lodge_content,Lodge_SellerInfo_BusinessNum
 쌍용동 카페호텔,충남 천안시 서북구 쌍용동 21052,9.9,모텔,//image.goodchoice.kr/resize_490x348/adimg_new/1045/183/93d85b9773710d016b6f07e4f52f1618.jpg,050448847825,사장님 한마디                    ▷안녕하세요 고객님2021.12.02 Cafe 호텔 새단장하여 오픈하였습니다.Book + Cafe OPEN특별한 경험을 해보세요Cafe 호텔은 커피향이 진하게 나는 여유로운 분위기 속에서사랑 낭만 추억 설레임이 남는 좋은곳으로기억될 수 있도록 머무시는 동안 한분 한분 편안함과 즐거움이 가득한 공간이 되도록 노력하겠습니다.조용히 책을 읽으며 차한잔을 즐기고 싶은 순간Cafe호텔로 오세요!                혜택안내객실문에 부착된 여기어때 혜택마크를 찾아 QR코드로 혜택받으세요.주차장 정보⭐주차장 정보 및 안내안심하세요 고객님!▷총30대 주차시설보유✔객실 1주차만 가능합니다. ✔1객실 2주차는 불가합니다.✔①주차장 안쪽에 주차를 하셔도 앞차의 차키를 다 받아놓습니다!②일찍 나가시는 고객님은 프론트에 미리 말씀 부탁드립니다.③주차가 어려우신✔ 고객님은 프론트에 차키를 던져주세요.(전문 발렛파킹 요원 대기중✌)④지하 주차장에서 주차하신 고객님은 E v 타시고프론트 1층까지 이동가능합니다(프라이버시보장✔)⑤2중 주차일 경우 ✔앞차는프론트에 키✔를 꼭 맡겨주세요!(뒤에 차량이 있는경우)⑦주차선은 잘 지켜주세요~^^⭐외부주차장 안내건물 앞 주차공간 ✔건물 앞에 주차 시 미리 연락주시면✔ 표지판을 치워드리거나 고객님 직접 ✔표지판을 치우고 셀프로✔ 주차하셔도 됩니다.외부주차장에 하신경우 프론트에 공유부탁드립니다^^(외부 주차하신 고객님은 차키를 안주셔도 됩니다.)주차선은 잘 지켜주세요~^^⭐지하주차장완비E v 타시고 소중한 짐과 함께 1층 프론트로 오시면 직접 키수령 가능하십니다.발렛파킹:프런트에 문의 바랍니다.주차:1실 1주차를 원칙으로 합니다.(1객실 2주차는 불가합니다.)입실전 주차(예약시간 전 주차할 경우)프론트에 사전 문의바랍니다.총 30대 주차시설 보유지하철 정보1호선 봉명역1호선 쌍용(나사렛대)역객실내부 시설☝여기어때 에디터Tip편세권의위치 =편의점 1분거리명품 치킨브랜드 =KFC 1분거리없는것 빼고 다잇소= 올리브영 다이소 1분거리아플때 찾아가는 =약국1분거리비빔밥맛집 = 1분거리떡순튀다파는 = 분식집1분거리영양죽집 = 본죽비빔밥1분거리돈까스맛집= 1분거리국민의은행 = 국민은행1분거리비타민보충=최저가과일집 1분거리대형마트 = 이마트 2분거리⭐카톡채널 OPEN포인트 관리(보관하시는 분에 한함) 현금10% 카드5% 적립 가능합니다. 어플예약 손님은 적립 불가합니다.Cafe호텔 (①추후배달맛집 ②데이트코스소개예정)분실물 관리(분실물 습득시 확인시스템) 다양한 이벤트 (BEST 이용후기 리뷰이벤트 임창정 최신앨범 1장 미니와인 1병)주차문의(실시간 주차 확인 시스템 입실 전 or 퇴실 1분전 확인해드립니다.)자정 00시 이후 객실이 마감이 되거나 없는 경우 ☎호텔로연락바랍니다전화 or 카톡 24시간 상담가능합니다 상담전화 01077584600 카톡ID:cafe2767⭐프론트 그외시설①북카페 전층 북카페 운영중입니다 Book + Cafe 동시에즐길수있습니다. 호텔 속에서 다양한 책을 볼 수 있는 천안 최초의 명소! 2층~8층까지 재미있는 책들이 꽉차있습니다.좋아하는 인연들과 마음의 휴식을 위해 떠나볼까요~? 낭만있는 스토리가 있습니다♪②오디오채널 복도에서부터 감성적인 좋은음악과 함께라면...산뜻하고 쾌적한 객실에서 마음의 휴식도 되고 TV채널 350번~370번 커피와 음악있는곳 ♬③OPEN 이벤트 캡슐커피 =전 객실 커피머신 설치♪ 프론트 앞 커피캡슐 1인당 1개씩! 셀프수령가능(추가 시 개당 1 000원^^)④꿀잠 매트리스 = 전 객실 천안 최초 꿀잠매트리스+원적외선 온열매트설치 아침에 일어나도가볍고피곤함이없습니다♬⑤향수바 OPEN =7종류의 향수와 좋은추억이 준비되어있습니다~ (1층 로비 E V앞) 아름다운 추억과 향기를 가득담아가세요~♬⑥성인들만 이용할 수 있는 놀이터 3층 E V앞 상륙 천안 최초 OPEN 아름다운 밤입니다. 그냥 들어가지 마세요 성인들만 3층에서 만나요^^⭐향수Bar OPEN  1층로비 (E V)앞 상륙아름다운 향기와 좋은 추억을 가득 담아가세요 ✌✌①랑방 메리향을 좋아하신다구요✔오픈특가♪②베이비 파우더 향을 좋아하신다구요✔ 아메리카노(여)♩③샤넬 옴므스포츠향을 좋아하신다구요✔아메리카노(남)♩④랑방 에끌라향을 좋아하신다구요✔카라멜마끼야또♪⑤화이트 머스크향을 좋아하신다구요✔ 카페라떼♬⑥샤넬 오땅드르향을 좋아하신다구요✔헤이즐럿♬⑦클린웜 코튼향을 좋아하신다구요✔카푸치노♩⭐이용후기이벤트(임창정최신앨범)(미니와인1병)이용후기를 정성스럽게 다시는분!우수 이용 후기 달아주시는 소중한 고객님 매주 2분을 선정하여매주 답글로 당첨 소식을 알려드립니다! (앨범 100장 소진시까지)이벤트물품※임창점싸인cd앨범1장 미니와인1병입니다 : )⭐Cafe 호텔 룸타입안내①아메리아카노룸1PC오버워치(노하드) 멀티플렉스영화관 65인치TV.삼성공기청정기 비데 캡슐커피머신 꿀잠매트리스+온열매트 (욕조문의✔)②카라멜마끼야또룸1PC오버워치(노하드) 멀티플렉스영화관 65인치TV삼성공기청정기 비데 캡슐커피머신 꿀잠매트리스+온열매트 욕조③카페라떼룸1PC오버워치(노하드) 멀티플렉스영화관 65인치TV 삼성공기청정기 비데 캡슐커피머신 꿀잠매트리스+온열매트 욕조④카푸치노룸1PC오버워치(노하드) 멀티플렉스영화관 65인치TV 삼성공기청정기 비데 캡슐커피머신 꿀잠매트리스+온열매트 욕조⑤헤이즐넛룸1PC오버워치(노하드) 멀티플렉스영화관 65인치TV 삼성공기청정기 비데 캡슐커피머신 꿀잠매트리스+온열매트 욕조Cafe호텔 룸타입안내⑥트윈룸1PC오버워치(노하드) 멀티플렉스영화관 65인치TV 삼성공기청정기 비데 캡슐커피머신 더블 퀸매트 꿀잠매트리스+온열매트 욕조⑦스타일드레서룸1PC오버워치(노하드) 멀티플렉스영화관 65인치TV 삼성공기청정기 비데 캡슐커피머신 LG트롬스타일러 꿀잠매트리스+온열매트 욕조⑧힐링안마룸1PC오버워치(노하드) 멀티플렉스영화관 65인치TV 삼성공기청정기 비데 캡슐커피머신 ✔세라젬안마기 꿀잠매트리스+온열매트 욕조⑨커플pc룸2PC배그✔(노하드) 멀티플렉스영화관 65인치TV 삼성공기청정기 비데 캡슐커피머신 2PC배그 꿀잠매트리스+온열매트 (욕조문의✔)⑩커플pc룸2PC일반✔(노하드) 멀티플렉스영화관 65인치TV 삼성공기청정기 비데 캡슐커피머신 2PC일반 꿀잠매트리스+온열매트 (욕조없음✔)⭐Cafe 배틀그라운드 전용 고사양 커플 2PC룸CPU:i510400FRAM:16GB그래픽:RTX2060게임전용 32인치 FULL HD 모니터 게이밍게임전용 키보드 마우스(게이밍 콤보)패드☝ 게임전용 헤드셋은 신분증을 보관해 주시면 대여가 가능합니다.프런트 및 그 외 시설⭐셀프바 스낵바 1층 로비에 셀프바를 오픈했습니다. 자유롭게 한강라면을 드실 수 있습니다.라면 아메리카노 토스터기(딸기잼)쿠키 옛날과자 커피캔디 아이스크림 커피캡슐 등등 여러가지 준비가 되어있으니 많은 이용 부탁드립니다.^^   ⭐비지니스 고객 이용서비스 (출장 지방출장)초간편 조식서비스라면bar 한강라면 이용가능디저트:토스트(딸기잼) 쿠키3종 등등음료: 아메리카노 or 아이스 아메리카노 이용가능추가 안내사항⭐이용안내전객실2인기준입니다 1인추가 추가요금10 000원발생추가요금 현장에서 결제바랍니다미성년자 출입금지 구역신분증없으면 입실불가 취소불가합니다온라인예약취소및환불: 예약 어플정책에따릅니다해당고객센터에 문의바랍니다.☎(16706250)365일오전9시~익일오전03시까지운영(여기어때)신분증:미성년자 이성혼숙방지를위하여 법적으로 신분증을 요구할권리가있으니 협조와 양해부탁드립니다⭐연박공지평일 연박시 호텔로 문의바랍니다 (특가룸 연박불가  커플pc 추가요금)토.일요일 공휴일은 연박시2만원 비용 추가됩니다.(연박비용 결제는 현장에서 결제및 계좌이체 가능합니다.)⭐통장입금계좌안내국민은행 정권철71400101380948⭐입실시간객실점검과 소독or브레이크타임으로 입실시간이 수시로 변경될수있습니다 소중한고객님! 다시한번 시간확인부탁드립니다. 최대한도와드리겠습니다⭐분실물 보관 기간✔분실물 호텔 프론트에 보관하며 고객 방문시(☎전화문의)✔대실 숙박여부 및 분실용품 등 간단한 확인을 통하여 일치할경우드리고있습니다✔음식물의 경우 당일폐기 이므로 당일이후에는 보관하지않습니다 ✔분실물은 별도 연락이없을경우 1개월 후 폐기하오니 참고부탁드립니다.✔퇴실하실때 고객님의 소중한 소지품을 한번만 확인해주세요⭐Cafe 호텔 방역수칙✔호텔 출입시 마스크를 꼭 착용해주세요.✔체크인시 프론트에 비치된 손 소독제로 손 소독을 해주세요.✔체크인시 증상여부(발열 호흡기증상등)가 있는 분은 미리 프런트에 공유부탁드리겠습니다.✔체크인 후 객실외 장소(1층로비 셀프바등) 이동하실떄도 마스크를 필히 착용해주세요✔Cafe 호텔위생관리수칙✔각 객실은 1회 사용후 객실소독(PC마우스 키보드등)을 원칙으로 한다.✔(숙박협회에서 인증한 인체에 무해한 소독약을 이용해 소독하고 있습니다.)✔침구린넨의 재사용은 엄격히 금한다.✔사용객실은 소독 후 일정시간 이상의 브레이크 타임을 적용한다.⭐고객감동 OPEN 이벤트1인당 1개 돌체구스토 캡슐커피과 아이스크림 ⭐도난방지 시스템 작동중저희 Cafe 호텔을 찾아주시는 고객님에게 감사의말씀을 드리면서 저희 Cafe호텔은객실점검 시스템과 유실방지 센서로 호텔의 자산관리보호 시스템을 작동중에있습니다감사합니다,7
 풍경펜션,충남 태안군 원북면 청산리 8754,7,펜션,//image.goodchoice.kr/resize_490x348/affiliate/2023/06/20/12/1684738886469lywjHUS66aXKVJoGuEY.jpg,050213969722,사장님 한마디                    아름다운 서해바다의 낙조와산림욕을 즐길 수 있는 소나무 숲의 솔내음에 마음이 편해지는 펜션입니다                주변정보안면암 차량 54분만리포해수욕장 차량 32분꽃지해수욕장 차량 57분공지사항[무한리필 바베큐 + 호텔식 조식뷔페]공용바베큐장 솥뚜껑 or 개별 테라스숯불요금: 2인 55 000원솥뚜껑 이용시간: 첫타임 18:00~19:30   두번째 타임 19:30~21:00테라스바베큐 이용시간 : 18:00~21:00구성: 삼겹살 목살 소세지 밥 된장찌개 김치 쌈무 마늘짱아치 상추 고추 양파 쌈장 기름장1인 추가 성인 20000원  미취학 (24개월이상~초등학생) 10 000원 추가현장결제기본 정보입실 : 15:00 | 퇴실 : 11:0022시 이후 입실 시 사전문의 (필수)무료 WiFi전 객실 금연주차 가능픽업 불가객실 정보전 객실 취사가능(객실 내 취사도구 및 식기류 구비)객실 내 육류(삽겹살 튀김류) 조리 금지인원 추가 정보1인 : 20 000원(아동 성인)영유아 기준인원 포함 및 추가요금 발생   최대인원 초과불가(유아:0세~11개월 아동 성인:12개월 이상)12개월 이상부터 초과요금 발생현장결제애견 입실 안내애견동반을 원할경우 사전문의 및 상담필수1마리당 : 20 000원 (10kg 미만 소형견만 가능)입실가능 객실 : A동 아련나래 101  A동 아련나래 102  A동 아련나래 103  D동 101호~D동 203호배변패드  강아지밥그릇  애견탈취제 구비되어있음현장결제펜션 서비스시설 이용문의 및 비용 별도 펜션문의[카약무료체험] 프라이빗한 바다에서 엑티비티홈페이지 참조(사전문의)[전기 스쿠터 무료대여]감성적인 스쿠터와 함께 인생샷을 찍어보세요인스타그램에 사진과 함께 게시물 업로드시 커피 + 크로플 or 생맥주 + 프리첼 제공자세한내용은 홈페이지 참조[인디언 텐트 대여]대여료 10 000원이용시간 18:00부터 21:00까지 불멍가능무한리필바베큐  숯불대여  불멍 텐트안에서 같이이용가능[불멍]2인기준 20 000원2인초과시 1인당 5 000원이용시간 18:00부터 21:00까지 불멍가능현장결제[호텔식 조식뷔페]2인 15 000원   1인 추가 시 5 000원운영시간 : 9:30 ~ 10:30현장결제[풍경카페]펜션 내 위치이용시간 : 입실 시 ~ 21:00 메뉴별 비용상이유료 현장결제 [매점]펜션 내 위치이용시간 9:00 ~ 21:00 메뉴별 비용상이현장결제[산책로]바다 산으로 산책 할 수 잇는 산책로 위치이용시간 : 제한없음무료이용워터슬라이드 운영(7월부터)배드민턴 캣치볼 갯벌체험 가능 ( 갯벌체험 도구 무료대여)바비큐 시설숯불만 대여   개별테라스 이용 2인 30 000원 (현장결제)취소 및 환불 규정숙박일 기준 7 일 전 : 100% 환불숙박일 기준 6 일 전 : 90% 환불숙박일 기준 5 일 전 : 85% 환불숙박일 기준 4 일 전 : 80% 환불숙박일 기준 3 일 전 : 70% 환불숙박일 기준 2 일 전 : 50% 환불숙박일 기준 1 일 전 : 30% 환불숙박일 기준 당일 및 NOSHOW : 환불불가취소  환불시 수수료가 발생할 수 있습니다확인사항 및 기타최대 인원 초과시 입실이 불가 합니다 (방문객 불가)보호자 동반없는 미성년자는 이용하실 수 없습니다해당 이미지는 실제와 상이 할 수 있습니다이용시설의 분실 및 훼손의 책임은 이용자에게 있으니 주의부탁드립니다객실 내에서는 화재위험물질 (화약  폭죽 등)은 사용 하실 수 없습니다 (화재로 인한 책임은 이용자에게 있습니다)쓰레기는 지정된 장소에 분리하여 주시기 바랍니다위의 정보는 펜션의 사정에 따라 변경될 수 있습니다성수기 기간동안 일부 객실의 경우 요금변동이 있을 수 있습니다수영장 운영은 날씨 또는 펜션 상황에 따라 변동 될 수 있습니다,8
 천안 호텔 아리아,충남 천안시 서북구 성정동 1412,9.6,모텔,//image.goodchoice.kr/resize_490x348/adimg_new/71941/466796/21bcb88abc3caf4cfe2d52584981b7d9.jpg,050440813077,사장님 한마디                    ❣️ 2022.09.02 천안 HOTEL ARIA GRAND OPEN❣️                주차장 정보✔ 만차 시  발렛서비스도보상품 빼고 나머지 객실당 1대 주차가능총 25대 주차시설 보유지하철 정보1호선 두정역1호선 천안역주변 정보❣️두정동 먹자골목 도보 15분❣️성정동 롯데마트 인근❣️두정역 1km객실내부 시설⭐천안 호텔 아리아 GRAND OPEN⭐✔ 전 객실 넷플릭스 시청가능✔ 전 객실 무선충전기 설치✔ 전 객실 65   스마트 TV✔ 2PC 객실 GTX3060   AMD라이젠54세대 5600X✔2PC 객실 삼성 오디세이 144Hz게이밍 모니터✔ VIP TWIN 객실 스타일러 설치✔ VIP 객실 공기청정기✔ VIP 객실 내 디자인 이동식 욕조 설치✔ VIP 및 트윈 2단 디자인 냉장고 설치✔ 프리미엄 테라스 객실 내 야외휴식공간❣️ 전 객실 모든 시설 내 도난방지 시스템 작동중입니다.프런트 및 그 외 시설⭐ 1층 로비 시설 안내 ⭐→ 에스프레소 머신 & 얼음정수기 비치.→ 전자레인지 비치.→ 쇼케이스 내 물 캔음료 비치.※물 및 캔음료는 객실에 기본 비치되어 있으니  필요하신 만큼만 챙겨주세요 : )추가 안내사항도보특가 객실 안내ㄴ 해당 객실은 도보로 입실하시는 고객님들에게 할인해주는 객실입니다.ㄴ 해당 객실 투숙 고객은 차량 주차는 불가합니다. 양해 부탁드립니다.,9
 홍성 이틀모텔,충남 홍성군 홍북읍 대인리 327,9.7,모텔,//image.goodchoice.kr/resize_490x348/adimg_new/70608/444114/3521d8cdd4de911b387d4e78aaf29db8.jpg,050440150172,사장님 한마디                    2022년 4월 20일 이틀 모텔이 새롭게 단장하였습니다.전 객실에 호텔식 침구류와 65인치 스마트 TV  넷플릭스를 설치하여 고객님들의 편안하고 즐거운 하루가 되도록 노력 하겠습니다.많은 관심 부탁드립니다. :)출장 가족여행 여행  비즈니스 고객님 시작과 끝은 이틀 모텔에서 함께 해주세요. 감사합니다.~^^                주차장 정보주차는 무제한 이용 가능 [대형 버스  덤프 이용 가능]총 50대 주차시설 보유주변 정보☆ 여기어때 에디터가 이틀모텔을 추천하는 이유⑴ 편세권_세븐일레븐 편의점 도보 2분 거리 ⑵ 맛집_김치찌개와 제육볶음 맛집 도보 2분거리 [계란 후라이와 스팸 구이 강추]⑶ 로또명당_홍성에 숨은 로또 명당 보유 [1등과 2등 다수 배출]⑷ 주유소 도보 2분_S Oil 주유소 보유 [언제든지 주유 가능]☆ 이틀모텔은 어디에 있을까요?핫플레이스 예산시장 차량 15분거리⑴ 예당 저수지 차량 10분 거리 [홍성의 포토존 출렁다리]⑵ 삽교역 (장항선) 차량 10분 거리⑶ 홍성역 (장항선) 차량 10분 거리⑷ 충남도청 차량 10분 거리객실내부 시설☆ 전 객실 넷플릭스 설치 완료 [무료 계정 이용 가능]☆ 전 객실 65인치 TV 설치 완료 [나만의 영화관]☆ 전 객실 호텔식 침구류 완비 [깐깐한 사장님의 선택]☆ 전 객실 Free WiFi 설치 완료☆ 전 객실 고데기 + 드라이기 2 in 1 설치 완료프런트 및 그 외 시설☆ 한강 라면 기계 설치 완료 [라면 구비],10
 동학사 호텔 디셈버,충남 공주시 반포면 학봉리 942,9.9,모텔,//image.goodchoice.kr/resize_490x348/adimg_new/72805/23112/7a6ffcd2b81e4cc9ce2a63bf276710b0.jpg,050440315763,사장님 한마디                    2022년 9월 신규오픈한 호텔 디셈버입니다. 청결하고 편안한 숙소를 위해 최선을 다하겠습니다이용하실때 불편한점이 있으시거나 부족한 점이있다면 0428250354 로 연락부탁드립니다. 감사합니다                주차장 정보1:1 드라이브 무인텔 객실당 1대 총 16대 주차 가능합니다.총 16대 주차시설 보유지하철 정보1호선 노은역1호선 월드컵경기장역주변 정보동학사 차량 5분거리에어산 구이산 도보 1분거리객실내부 시설전 객실 넷플릭스   유튜브 시청가능전 객실 65인치 스마트 TV전 객실 삼성 에어드레서전 객실 공기청정기 구비 전 객실 비데 설치노트북 대여가능전 객실 초고속 WIFI 전 객실 컵라면 제공전 객실 간단한 다과제공추가 안내사항도착하시기 30분 전 전화주시면 객실배정 도와드리겠습니다 ☎ 0428250354낮 숙박 가능   7시간 이용가능   숙박입실시간 전까지만 이용가능   주중만 이용가능   전화예약필수24시간 대실 이용 가능합니다. 밤 12시 이후 대실예약은 전화문의 부탁드립니다.기준인원 초과 시 1인 10 000원의 추가요금 발생됩니다. (현장결제)아동(7세 이하)의 입실 무료  8세부터는 추가요금 발생됩니다.미성년자 예약으로 인해 발생되는 입실 거부에 대해서는 취소 환불이 절대 불가합니다.반려동물 동반 금지   취사 금지,1
 풀빌라 바다린,충남 태안군 근흥면 용신리 93311,7,펜션,//image.goodchoice.kr/resize_490x348/affiliate/2023/07/07/64a75f6020988.jpg,050440651674,사장님 한마디                    프라이빗한 공간 사랑하는 이 와 오붓한 여행을 즐길 수 있는 풀빌라입니다서해바다의 일몰을 바라보며 자연이 들려주는 소리를 들으며 쉼을 느낄 수 있습니다                주변정보연포해수욕장 차량 7분천리포수목원 차량 26분파도리해식동굴 차량 30분기본정보입실 : 15:00 | 퇴실 : 11:0022시 이후 입실 시 사전문의 (필수)무료 WiFi전 객실 금연주차 가능객실정보개별 수영장 (사계절 운영) : 26~28도 무료   30~32도 추가 50 000원인원 추가 정보1인 30 000원 (소인  대인)   12개월 미만 무료영유아 인원수 포함   최대인원 초과불가침구 추가 : 20 000원현장 결제펜션 서비스시설 이용문의 및 비용 별도 펜션문의카드결제 가능모닥불 : 30 000원바비큐 시설숯+그릴 대여 : 기본 1SET 30 000원이용시간 : 15:00~23:00개별 바비큐 가능현장 결제취소 및 환불 규정숙박일 기준 6일전 : 100% 환불숙박일 기준 5일전 : 90% 환불숙박일 기준 4일전 : 80% 환불숙박일 기준 3일전 : 70% 환불숙박일 기준 2일전 : 50% 환불숙박일 기준 1일전 : 30% 환불숙박일 당일 및 Noshow : 환불불가취소  환불 시 수수료가 발생할 수 있습니다확인사항 및 기타최대 인원 초과시 입실이 불가 합니다 (방문객 불가)객실 내 육류  튀김류  생선류 조리를 할 수 없습니다전 객실 애완동물 출입이 불가합니다보호자 동반없는 미성년자는 이용하실 수 없습니다해당 이미지는 실제와 상이 할 수 있습니다이용시설의 분실 및 훼손의 책임은 이용자에게 있으니 주의부탁드립니다객실 내에서는 화재위험물질 (화약  폭죽 등)은 사용 하실 수 없습니다 (화재로 인한 책임은 이용자에게 있습니다)쓰레기는 지정된 장소에 분리하여 주시기 바랍니다위의 정보는 펜션의 사정에 따라 변경될 수 있습니다성수기 기간동안 일부 객실의 경우 요금변동이 있을 수 있습니다수영장 운영은 날씨 또는 펜션 상황에 따라 변동 될 수 있습니다,2
 아산 포유무인텔,충남 아산시 음봉면 신수리 2605,9.6,모텔,//image.goodchoice.kr/resize_490x348/adimg_new/75032/522721/adee82ee11205212e4fd9e4f5d3cf68b.jpg,050240176083,주차장 정보총 20대 주차시설 보유,3
